{
  "triage_level": "ESI-2 (emergent)",
  "justification": "The patient's high blood pressure (BP 158/96), tachycardia (HR 104), and SpO2 of 94% indicate a potential cardiac issue. The crushing substernal chest pain radiating to the left arm, along with diaphoresis, further supports this concern.",
  "evidence_ids": [
    "E1",
    "E2",
    "E3",
    "E4",
    "E5"
  ],
  "confidence": 0.8
}